product_name,price,rating,Number_of_Reviews,Product_url
American Tourister Fizz Large Size 32 Ltrs Casual Backpack (BLACK),"₹1,199",4.0 out of 5 stars,"54,975",https://www.amazon.in/American-Tourister-AMT-SCH-02/dp/B07CJCGM1M
Wesley Milestone 2.0 Casual Waterproof Laptop Backpack/Office Bag/School Bag/College Bag/Business Bag/Travel Backpack (Dimensions:13x18 inches) (Compatible with 39.62cm(15.6inch laptop) 30 L (Blue & black),₹550,4.3 out of 5 stars,"11,827",https://www.amazon.in/Wesley-Milestone-Waterproof-Backpack-Business/dp/B084JGJ8PF
Skybags Brat Black 46 Cms Casual Backpack,₹669,4.1 out of 5 stars,"5,172",https://www.amazon.in/Skybags-Brat-Black-Casual-Backpack/dp/B08Z1HHHTD
Half Moon Large 37L Laptop Bag Backpack for menं Women Boys and Girls Luggage Travel Bags with 17.3 inches Laptop Compartment & Rain Cover,₹849,3.9 out of 5 stars,"3,218",https://www.amazon.in/Half-Moon-Backpack-Luggage-Compartment/dp/B09VCLZ3K4
"Half Moon 35 Ltrs Water Resistant 15.6 inch Laptop Bag for Men/Backpack for Men, Navy Blue | Office Bag for Men/Office Bag for Women with Padded Laptop Compartment | Rain Cover & Reflective Strips",₹649,3.9 out of 5 stars,"16,569",https://www.amazon.in/Half-Moon-Waterproof-Backpack-Students/dp/B085MHDJ93
Gear Classic 20L Faux Leather Water Resistant Anti Theft Laptop Bag/Backpack for Men/Women (Brown),₹987,4.4 out of 5 stars,"5,915",https://www.amazon.in/Gear-Classic-Leather-Backpack-LBPCLSLTH0201/dp/B07G4F6XFH
Safari Compact Size 15 Ltrs Casual Backpack For Unisex Adult - Sea Blue,₹248,4.0 out of 5 stars,"19,994",https://www.amazon.in/SAFARI-Ltrs-Casual-Backpack-DAYPACKNEO15CBSEB/dp/B07Q7CNPMV
Wesley Spartan Unisex Travel Hiking Laptop Bag fits Upto 17.3 inch with Raincover and Internal Organiser Backpack Rucksack College Bag,₹749,4.1 out of 5 stars,"1,551",https://www.amazon.in/Wesley-Spartan-Hiking-Raincover-Organiser/dp/B098QFF5TJ
"American Tourister VALEX BLACK LAPTOP BACKPACK 28 Ltrs,Volume, LAPTOP COMPARTMENT, BOTTLE POCKET, FRONT ORGANIZER","₹1,199",4.3 out of 5 stars,549,https://www.amazon.in/American-Tourister-BACKPACK-COMPARTMENT-ORGANIZER/dp/B0BTD4S4XF
"TRUE HUMAN Emperor Anti-Theft backpack With USB charging Port Laptop Bag, Office bag, college bag and anti -theft back pocket (Black)",₹689,3.8 out of 5 stars,"2,304",https://www.amazon.in/TRUE-HUMAN-Anti-Theft-backpack-charging/dp/B09QJ7ZF2Y
ADISA 15.6 inch Laptop Backpack Office Bag College Travel Back Pack 32 Ltrs (z-Navy Blue),₹549,3.9 out of 5 stars,"1,015",https://www.amazon.in/ADISA-Laptop-Backpack-Office-College/dp/B09TPX22NF
NORTH ZONE Casual Waterproof Laptop Backpack/Office Bag/School Bag/College Bag/Business Bag/Travel Backpack (Dimensions:13x18 inches) (Compatible with 39.62cm(15.6inch laptop) 30 L,₹499,4.0 out of 5 stars,474,https://www.amazon.in/NORTH-ZONE-Waterproof-Backpack-Dimensions/dp/B0BS6QQZYN
"Wesley Milestone 2.0 Casual Waterproof Laptop Backpack/Office Bag/School Bag/College Bag/Business Bag/Travel Backpack (Dimensions:13x18 inches) (Compatible with 39.62cm(15.6inch laptop) 30 L, Charcoal black",₹550,4.3 out of 5 stars,"11,827",https://www.amazon.in/Wesley-Milestone-Waterproof-Backpack-Business/dp/B085S444JV
Gear Cello 30 Ltrs Black Laptop Backpack (LBPASPIRE0104),"₹1,125",4.4 out of 5 stars,"5,904",https://www.amazon.in/Gear-Black-Laptop-Backpack-LBPASPIRE0104/dp/B075MK4TXP
"Lenovo 15.6"" (39.62cm) Slim Everyday Backpack, Made in India, Compact, Water-resistant, Organized storage:Laptop sleeve,tablet pocket,front workstation,2-side pockets,Padded adjustable shoulder straps",₹839,4.3 out of 5 stars,"3,689",https://www.amazon.in/Lenovo-15-6-Inches-Everyday-Backpack/dp/B08R7RPVJF
Northzone Lightweight school bags Backpacks for Boys Girls Stylish men and women Casual Travel Laptop Bag College office (Black) 40L,₹415,4.0 out of 5 stars,121,https://www.amazon.in/NORTH-ZONE-Lightweight-Backpacks-Stylish/dp/B0BL3TVDK6
"FUR JADEN Anti Theft Number Lock Backpack Bag with 15.6 Inch Laptop Compartment, USB Charging Port & Organizer Pocket for Men Women Boys Girls",₹679,4.0 out of 5 stars,"4,901",https://www.amazon.in/Number-Backpack-Compartment-Charging-Organizer/dp/B09VTDMRY7
LOOKMUSTER (15.6 inch 30 L Casual Waterproof Laptop Backpack/Office Bag/School Bag/College Bag/Business Bag/Unisex Travel Backpack,₹439,3.9 out of 5 stars,31,https://www.amazon.in/LOOKMUSTER-Waterproof-Backpack-College-Business/dp/B0BZW8KW18
Gear CarryOn 16L Foldable Water Resistant School Bag//Backpack/College Bag for Men/Women - Blue Black,₹224,3.7 out of 5 stars,"6,823",https://www.amazon.in/GEAR-Black-Blue-Backpack-years/dp/B019HA8AYG
"Mi Step Out 12 L Mini Backpack (Small Size, Black, Water Repellant)",₹398,4.1 out of 5 stars,"9,457",https://www.amazon.in/Backpack-Small-Black-Water-Repellant/dp/B088XB5XY8
Safari Quill Large Laptop Backpack 26 Ltrs Water Resistant Fabric - Black,₹899,3.9 out of 5 stars,969,https://www.amazon.in/Safari-Laptop-Backpack-Resistant-Fabric/dp/B09B25Z8M2
Sfane Polyester 23cms Duffle/Shoulder/Gym Bag for Men & Women with Separate Shoe Compartment (Grey),₹427,4.3 out of 5 stars,"7,619",https://www.amazon.in/SFANE-Duffel-Shoulder-Women-Compartment/dp/B07XXFB9CZ
"Safari Flash Casual Backpack, 26 ltr Water Resistant Travel Bags| Weight Polyester Bagpack for Men and Women, Spacious Shoulder Bag for College, Office, Travelling and Camping",₹799,3.8 out of 5 stars,"2,969",https://www.amazon.in/Safari-Backpack-Resistant-Polyester-Travelling/dp/B09B29F66W
Safari Quill Large Laptop Backpack 26 Ltrs Water Resistant Fabric - Blue,₹899,4.0 out of 5 stars,711,https://www.amazon.in/Safari-Laptop-Backpack-Resistant-Fabric/dp/B09B28TKLG
Martucci 15.6 inch 30 L Casual Waterproof Laptop Backpack/Office Bag/School Bag/College Bag/Business Bag/Unisex Travel Backpack(Black),₹549,3.9 out of 5 stars,"7,659",https://www.amazon.in/Martucci-Casual-Travelling-Laptop-Backpack/dp/B088B4P6ZW
NIVIA Basic Duffle Polyester Bag/Gym Bags/Adjustable Shoulder Bag for Men/Duffle Gym Bags for Men/Fitness Bag/Carry Bags/Sports & Travel Bag/Sports Kit/Duffle Bags Travel,₹269,4.0 out of 5 stars,"3,676",https://www.amazon.in/Nivia-6853-Polyester-Basic-Duffle/dp/B07FWQ9HRV
Arctic Fox 15 Liters Draw String Bag Lavender Backpack,₹229,4.3 out of 5 stars,"3,387",https://www.amazon.in/Arctic-Fox-Liters-String-Backpack/dp/B08L6Q9V1H
"Fur Jaden 55 LTR Rucksack Travel Backpack Bag for Trekking, Hiking with Shoe Compartment",₹849,4.3 out of 5 stars,"5,467",https://www.amazon.in/Rucksack-Travel-Backpack-Trekking-Compartment/dp/B07YDGQQN5
"WILDHORN 31L Laptop Backpack for Men/Women I Fits upto 15.6"" Laptop I Waterproof I Travel/Business/College Bookbags",₹599,4.0 out of 5 stars,"1,446",https://www.amazon.in/WILDHORN-Backpack-Compartment-Business-Stitching/dp/B09QL81ZHB
Gear Cello Classic Anti Theft Faux Leather 20 Ltrs Navy Laptop Backpack (LBPCLSLTH0519),₹987,4.4 out of 5 stars,"6,492",https://www.amazon.in/Gear-Classic-Leather-Backpack-LBPCLSLTH0519/dp/B07G4JQX2F
"TRUE HUMAN® Emperor Anti-Theft Pocket backpack With USB charging Port Laptop,office,college,travel bag for men and women(Epower)",₹680,3.6 out of 5 stars,179,https://www.amazon.in/TRUE-Emperor-Anti-Theft-backpack-charging/dp/B0BYB631NR
Bennett™ Mystic Unisex Adult Men's Laptop Bag 15.6 inch Side Shoulder Briefcase Satchel Messenger Business Bags for Men & Women Front Pocket for Laptop Accessories - Black (6 Month Warranty),₹512,4.0 out of 5 stars,"6,184",https://www.amazon.in/BennettTM-Shoulder-Messenger-Repellent-Charcoal/dp/B09CV24TMK
"Safari Spartan 21 Ltrs Water Resistant Backpack - Teal, S (SPARTAN19CBTEA)",₹599,3.8 out of 5 stars,896,https://www.amazon.in/Safari-Spartan-Water-Resistant-Backpack/dp/B09B277CR5
"FATMUG Laptop Bag For Men - Convertible Backpack For Office And Travel (Dark Grey,Oxford Fabric)","₹1,599",4.4 out of 5 stars,"2,165",https://www.amazon.in/FATMUG-Laptop-Bag-Men-Convertible/dp/B084LF4RT5
Arctic Fox Slope Anti Theft 23 L Backpack with USB Charging Port 15 Inch Laptop Backpack (Marble Black),"₹1,439",4.5 out of 5 stars,"4,024",https://www.amazon.in/Arctic-Fox-Backpack-Charging-Laptop/dp/B089QBD333
"FUR JADEN 15.6 Inch Smart Laptop Backpack Bag With USB Charging Port, Anti Theft Pocket and Accessories Organiser for Men Women Boys Girls","₹1,329",4.1 out of 5 stars,559,https://www.amazon.in/FUR-JADEN-Backpack-Accessories-Organiser/dp/B0BSHBH9K2
FUR JADEN Anti Theft Backpack 15.6 Inch Laptop Bag with USB Charging Port For Men Women Boys Girls,₹839,4.0 out of 5 stars,"13,798",https://www.amazon.in/Fur-Jaden-Black-Waterproof-Backpack/dp/B078GLXMDY
"Walkent Stylish 15.6"" Laptop Bag (Model Ritzy) Hi-Quality PU, Waterproof, Anti Theft, External USB, Scratch Resistant for Office College Men Women","₹2,809",4.3 out of 5 stars,118,https://www.amazon.in/Ritzy-Waterproof-Hi-Quality-External-Resistant/dp/B09Q172X7J
"AirCase Laptop Bag Backpack Case Pouch for Laptop Backpack for Men & Women,Premium Vegan Leather",₹929,3.8 out of 5 stars,856,https://www.amazon.in/AirCase-C34-Laptop-Backpack-Women/dp/B07QN4KXWG
Safari Sheild 26 Ltrs Water Resistant Casual Backpack - (SHEILD19CBBLK),₹699,3.9 out of 5 stars,"1,102",https://www.amazon.in/Safari-Sheild-Resistant-Casual-Backpack/dp/B09B26T7KQ
Zipline Unisex casual polyester 36 L Backpack School Bag Women Men Boys Girls children Daypack College Bag Book School Sports Bag Weekend Bag,₹843,4.0 out of 5 stars,"6,082",https://www.amazon.in/ZIPLINE-Polyester-Backpack-Children-Daypack/dp/B07XVMR33Q
"Lenovo 15.6"" Casual Backpack B210",₹749,4.1 out of 5 stars,"18,648",https://www.amazon.in/Lenovo-Laptop-Backpack-15-6-Inch-GX40Q17225/dp/B075Y72PHZ
"Safari Sneak Casual Backpack with USB Charging Port 26 Ltrs Water Resistant Fabric - Grey, L (SNEAK19CBGRE)",₹949,3.8 out of 5 stars,"1,017",https://www.amazon.in/Safari-Casual-Backpack-Charging-Resistant/dp/B09B2581S9
ADISA 31 Ltrs Casual Backpack School College Bag Pack,₹399,3.8 out of 5 stars,124,https://www.amazon.in/ADISA-Casual-Backpack-College-BP046-NAV_Navy/dp/B0BX3QFVSM
Wesley Milestone 15.6 inch 25 L Casual Waterproof Laptop Backpack/Office Bag/School Bag/College Bag/Business Bag/Unisex Travel Backpack (Black),₹448,4.3 out of 5 stars,"13,084",https://www.amazon.in/Wesley-Milestone-Waterproof-Backpack-Business/dp/B07NJRPJ6Q
"Storite Dust & Rain Cover for Backpack with Pouch, Waterproof Dustproof Rain Cover Bag Elastic Adjustable for School, College,Office, Trekking Bags (30L-35L,Black)",₹199,4.6 out of 5 stars,18,https://www.amazon.in/Storite-Backpack-Waterproof-Dustproof-Adjustable/dp/B0C7ZWNBJZ
"Mi Step Out 12 L Mini Backpack (Small Size, Red, Water Repellant)",₹319,4.1 out of 5 stars,"9,457",https://www.amazon.in/Step-Backpack-Small-Water-Repellant/dp/B088XG77KN
Genie Flamenco2 Casual Backpacks for Women,₹729,4.3 out of 5 stars,"1,507",https://www.amazon.in/Genie-Flamenco2-Backpack-Compatible-Resistant/dp/B08YF9VHTY
DEIN KLEIDER Men's Nylon Messenger Bag,₹349,4.0 out of 5 stars,"5,131",https://www.amazon.in/Kleider-Travel-Business-Messenger-Shoulder/dp/B084ZHP97M
"STRABO Cooper for Boys Girls Stylish Men and Women Casual 15"" inch 25L CANVAS Laptop BACKPACK | Office, College, Travel Bag",₹699,4.4 out of 5 stars,50,https://www.amazon.in/STRABO-Cooper-Laptop-Bag-Capacity/dp/B0BX9SVT1D
NORTH ZONE Lightweight school bags Backpacks for Boys Girls Stylish men and women Casual Travel Laptop Bag College office,₹470,3.9 out of 5 stars,828,https://www.amazon.in/NORTH-ZONE-Lightweight-Backpacks-Stylish/dp/B0BL3SPN16
American Tourister Casual Backpack,"₹1,249",4.2 out of 5 stars,"4,049",https://www.amazon.in/American-Tourister-AMT-SCH-BAG02/dp/B07CGLDV2C
Half Moon Large 37L Laptop Bag Backpack for menं Women Boys and Girls Luggage Travel Bags with 17.3 inches Laptop Compartment & Rain Cover,₹849,3.9 out of 5 stars,"3,218",https://www.amazon.in/Half-Moon-Resistant-Backpack-Compartment/dp/B0BHX7GY16
Bennett™ Mystic Formal Business Briefcase Bag Crossbody Messenger College Bags For Men Women MacBook INoteBook ITablet Laptop Upto 15.6 Inch | Handbags with Shoulder Straps (Blue) 6 Months Warranty,₹512,4.0 out of 5 stars,"6,184",https://www.amazon.in/Bennett-Mystic-Shoulder-Messenger-Repellent/dp/B08X2T2M8G
Tommy Hilfiger Joshua Laptop Backpack,"₹2,079",4.2 out of 5 stars,342,https://www.amazon.in/Hilfiger-Joshua-Backpack-TH-JOSHUALAP01/dp/B07N8GRWTZ
Bagneeds Men's Black Synthetic Leather Briefcase Best Laptop Messenger Bag Satchel for Men,₹759,4.1 out of 5 stars,"4,488",https://www.amazon.in/Bagneeds-Synthetic-Leather-Briefcase-Messenger/dp/B0855F8174
"Wooum Crossbody Sling Bag - Durable Shoulder Bag with Adjustable Strap One Side Bag for Commuting Travel Outdoor Activities Cycling - Sling Bag Travel Hiking Chest Bag Daypack – Colour Black-Grey – (Pack of 1 Bag) - Unisex Cross Body Backpack for Travel, College, Tuition",₹379,3.7 out of 5 stars,10,https://www.amazon.in/Wooum-Crossbody-Sling-Bag-Adjustable/dp/B0C1K59WV5
NORTH ZONE Casual Waterproof Laptop Backpack/Office Bag/School Bag/College Bag/Business Bag/Travel Backpack (Dimensions:13x18 inches) (Compatible with 39.62cm(15.6inch laptop) 30 L,₹499,4.0 out of 5 stars,474,https://www.amazon.in/NORTH-ZONE-Waterproof-Backpack-Dimensions/dp/B0BS6QM2GD
"American Tourister VALEX BLUE LAPTOP BACKPACK 28 Ltrs,Volume, LAPTOP COMPARTMENT, BOTTLE POCKET, FRONT ORGANIZER","₹1,399",4.2 out of 5 stars,506,https://www.amazon.in/American-Tourister-BACKPACK-COMPARTMENT-ORGANIZER/dp/B0BTD4FK9G
"Wesley Unisex Milestone Casual Waterproof Laptop Office School College Business Travel Backpack 25 L (Dimensions: 12.5x18 inches) (Compatible with 15.6 inch laptops), Navy Blue",₹448,4.3 out of 5 stars,"13,084",https://www.amazon.in/Wesley-Milestone-Waterproof-Backpack-Business/dp/B07K8KLB3P
EXOTIC Women's Sling Bag,₹450,4.2 out of 5 stars,"2,486",https://www.amazon.in/Exotic-Sling-Womens-Girls-Grey/dp/B092VSZ69M
ADISA 32 Ltrs Water Resistant Casual Travel Bagpack/College Backpack/School Office Bag for Men and Women,₹499,4.0 out of 5 stars,"4,019",https://www.amazon.in/ADISA-BP010-Weight-Casual-Backpack/dp/B07NPW84SS
Half Moon Strike 35L Unisex Spacious School/Laptop/College/Office Travel Backpack Bag for Men Women Boys & Girls with 15.6 inch Padded Laptop Compartment & Multiple Pockets,₹699,3.8 out of 5 stars,574,https://www.amazon.in/Half-Moon-Resistant-Backpack-Compartment/dp/B0BLVQ9NTD
Zipline Unisex Casual Polyester 36 L Backpack School Bag Women Men Boys Girls Children Daypack College Bag Book School Sports Bag,₹843,3.6 out of 5 stars,927,https://www.amazon.in/Zipline-Nexa-Resistant-Bagpack-Backpack/dp/B08WQ668WJ
DZert Kids School Bag Soft Plush Backpacks Cartoon Boys Girls Baby (2-5 Years),₹249,3.7 out of 5 stars,"11,931",https://www.amazon.in/DZert-Panda-School-Backpacks-Cartoon/dp/B07WSBV3BN
URBAN CARRIER School Bag For girls school bags for boys Class 5-10 Large 4 partition 45 L Laptop Collage Office Travel Unisex Backpack,₹431,3.5 out of 5 stars,946,https://www.amazon.in/School-school-partition-Collage-Backpack/dp/B09NNYCQ1Q
NIVIA Deflate Round 01 Polyester Gym Bag/Unisex Gym Bags/Adjustable Shoulder Bag for Men/Duffle Gym Bags for Men/Carry Gym Accessories/Fitness Bag/Sports &Travel Bag/Gym kit Bag,₹439,4.2 out of 5 stars,"7,459",https://www.amazon.in/Nivia-Deflate-5180BK-Polyester-Round/dp/B07222KX3S
Lavie Sport Lino M Duffle Wheeler Bag for Travel | 2 Wheel Luggage Bag | Travel Bag with Adjustable Handle,₹749,3.8 out of 5 stars,"3,269",https://www.amazon.in/Lavie-Sport-Duffle-Luggage-Wheeler/dp/B0992JCN1W
Gear Cello 26 Ltrs Navy Blue and Beige Casual Backpack (BKPTRMP520522),₹838,4.2 out of 5 stars,"5,668",https://www.amazon.in/Gear-Beige-Casual-Backpack-BKPTRMP520522/dp/B00VWM11HQ
ADISA Light Weight Laptop Backpack 32 Ltrs,₹499,4.0 out of 5 stars,"6,013",https://www.amazon.in/ADISA-BP005-Weight-Casual-Backpack/dp/B07F3X45WZ
"POLESTAR Vintage 15.6 inch 32 LTR Casual Laptop Backpack/Office Bag/School Bag/College Bag/Business Bag/Unisex Backpack, Water Resistant and Light Weight, 1 year Warranty",₹549,3.9 out of 5 stars,"9,026",https://www.amazon.in/POLESTAR-Vintage-Laptop-Backpack-bagpack/dp/B081GSQ9D9
F Gear Luxur Brown 25 liter Laptop Backpack (2404),"₹1,162",4.4 out of 5 stars,"16,960",https://www.amazon.in/F-Gear-Luxur-Brown-Backpack/dp/B01F7AX9ZA
Lenovo 15.6-inch Casual Laptop Briefcase T210,₹979,4.2 out of 5 stars,"20,388",https://www.amazon.in/Lenovo-Carrying-15-6-Inch-Toploader-GX40Q17229/dp/B075Y6Y9H5
Half Moon 45L Hammer Waterproof Laptop Travelling Rucksack Trekking Backpack for Travel Journey bags for Men Women Boys & Girls with 17.3inch Laptop Compartment & Rain cover,"₹1,399",4.1 out of 5 stars,"1,361",https://www.amazon.in/Half-Moon-Trekking-Bags-Compartment/dp/B08PSX1LN9
POLICE Backpack for Men Casual Laptop Bag Office/Travel/College 30 Ltr Hedge Polyester - Black,"₹1,399",4.1 out of 5 stars,"5,731",https://www.amazon.in/Police-Polyester-laptop-casual-backpack/dp/B09CQ5T3LN
"Luv Lap LuvLap Baby Breast Milk Storage Bags (Pack of 25), BPA Free Disposable Milk Freezer Bags for Breast Feeding, Transparent",₹349,4.4 out of 5 stars,708,https://www.amazon.in/Storage-Disposable-Freezer-Feeding-Transparent/dp/B099ZZ57FT
Lavie Women's Nova Tote Bag | Ladies Purse Handbag,₹929,4.2 out of 5 stars,"8,589",https://www.amazon.in/YuvKuz-TM-Infocus-Digitizer-Assembly/dp/B07MXNWTB2
"Genie Heartbeat Backpack for Women 3 compartments, School Bags for Girls, Stylish and Trendy College Backpacks for Girls, Water Resistant and Lightweight Bags for Office and Travelling Purpose.",₹999,4.5 out of 5 stars,268,https://www.amazon.in/Genie-Heartbeat-compartments-Lightweight-Travelling/dp/B097JJFF6Z
"LIBRA LED Motorcycle Hard Shell Backpack, Waterproof Backpack with Programmable and Color Screen, DIY Smart LED Display, Travel Backpack, Laptop Bag for Men","₹24,889",4.0 out of 5 stars,1,https://www.amazon.in/LIBRA-Motorcycle-Backpack-Waterproof-Programmable/dp/B0C944JRPV
F Gear Miles Guc Black Sports Waist Bag (3681),₹449,4.4 out of 5 stars,430,https://www.amazon.in/F-Gear-Miles-Guc-Black-Waist-Bag/dp/B08NYGBDB8
"Lunar's V-Line Backpack for Men, Blue | 35L Water Resistant School Bags for Boys | Stylish, & Durable | College Bags for Men/College Bag for Girls | 1 Yr Warranty",₹799,4.1 out of 5 stars,"2,629",https://www.amazon.in/Lunars-V-Line-Resistant-Bagpack-College/dp/B08BP5CYDV
Gear Vintage2 28L Faux Leather Water Resistant Anti Theft Laptop Bag/Backpack for Men/Women (Black),₹979,4.4 out of 5 stars,"1,837",https://www.amazon.in/Gear-Vintage2-Leather-Backpack-LBPVG2LTH0101/dp/B07G44G1DC
"RNTR® Cosmetic Pouch, Make up Bag for Home & Travel, Toiletry Bag for Cosmetics, Brushes, Accessories Set of 3 - Wash Bag - Light Pink and Black (Pink)",₹489,4.7 out of 5 stars,93,https://www.amazon.in/Cosmetic-Toiletry-Cosmetics-Brushes-Accessories/dp/B0C74Q2YWS
"WILDHORN 31L Laptop Backpack for Men/Women I Fits upto 15.6"" Laptop I Waterproof I Travel/Business/College Bookbags",₹599,4.0 out of 5 stars,"1,446",https://www.amazon.in/WILDHORN-Backpack-Compartment-Business-Stitching/dp/B09QL66G55
Half Moon Large 37L Laptop Bag Backpack for menं Women Boys and Girls Luggage Travel Bags with 17.3 inches Laptop Compartment & Rain Cover,₹849,3.9 out of 5 stars,"3,218",https://www.amazon.in/Half-Moon-Resistant-Backpack-Compartment/dp/B0BJ32LQ6X
Bennett™ Mystic 15.6 inch (39.6cm) Laptop Briefcase Shoulder Sling Office Business Professional Travel Messenger Bag for Men and Women Water Repellent Formal Executive Bags (Grey) 6 Months Warranty,₹512,4.0 out of 5 stars,"6,184",https://www.amazon.in/BennettTM-Mystic-Shoulder-Messenger-Repellent/dp/B09321GJXZ
ADISA Laptop Backpack 31 Ltrs,₹499,4.0 out of 5 stars,"8,962",https://www.amazon.in/ADISA-BP004-Weight-Casual-Backpack/dp/B07G3CG9FC
F Gear Blackhawk 40 Ltrs Black Laptop Backpack (3178),"₹1,430",4.3 out of 5 stars,"1,035",https://www.amazon.in/F-Gear-Blackhawk-Black-Laptop-Backpack/dp/B07XMRGQCM
"TABELITO Casual Laptop Backpack 15.6-inch, 25 LTR Water Repellent",₹549,4.0 out of 5 stars,682,https://www.amazon.in/Tabelito-Laptop-Backpack-15-6-inch-Repellent/dp/B08Y5S6C2P
"FUR JADEN Travel Laptop Backpack, Business Backpacks with USB Charging Port, Water Resistant College School Computer Bag for Men & Women Fits Under 15.6 inch Laptop and Notebook",₹949,4.3 out of 5 stars,480,https://www.amazon.in/Backpack-Business-Backpacks-Charging-Resistant/dp/B094DGX84G
"FATMUG Polyester Foldable Duffle Travel Bag Luggage For Travel, Packing And Storage - Men And Women - (60 L, Black)","₹1,099",4.2 out of 5 stars,"1,405",https://www.amazon.in/FATMUG-Foldable-Luggage-Packing-Storage/dp/B07YFNXC3H
ADISA 32L Large Laptop Backpack Office Bag College Travel Back Pack with rain Cover (Grey),₹699,3.8 out of 5 stars,261,https://www.amazon.in/ADISA-Laptop-Backpack-Office-College/dp/B0BPVLXD53
"Dyazo Water Resistant Camera Bag/Case Shoulder Strap Space for Photography Lens and Accessories Compatible for Nikon, Canon, Sony, Panasonic, Samsung & Other SLR/DSLR etc (Black & Silver)",₹799,4.4 out of 5 stars,414,https://www.amazon.in/Resistant-Photography-Accessories-Compatible-Panasonic/dp/B0BRJLWQ6R
Red Lemon Swisslook Polyester Bange Series 45L 15.6-inch Laptop Bags Backpack for Men and Women Semi Waterproof USB with Anti Theft Pocket Travel Backpack,"₹2,839",4.3 out of 5 stars,"1,704",https://www.amazon.in/Swisslook-Polyester-15-6-inch-Backpack-Waterproof/dp/B07XYTZP4Z
"Amazon Basics Laptop Messenger Bag with Adjustable Shoulder Strap, Padded Compartment & Storage Pockets, Lightweight, Water-Resistant, Travel-Friendly, Fits Up To 15.6"" Laptops (Unisex, Black & Grey)",₹799,4.7 out of 5 stars,984,https://www.amazon.in/Adjustable-Compartment-Lightweight-Water-Resistant-Travel-Friendly/dp/B0C3RDFPVN
ZOUK Mughal Art Printed Handmade Vegan Leather Women's Office Bag for 15.6 inch Laptop with Double Handles,"₹1,689",4.2 out of 5 stars,105,https://www.amazon.in/ZOUK-Womens-Office-Bag-Multicolour/dp/B09DF2NPCS
ADISA 31 Ltrs Casual Backpack School College Bag Pack,₹399,3.8 out of 5 stars,124,https://www.amazon.in/ADISA-Casual-Backpack-College-BP046-Black/dp/B0BXJRQRJM
"SPENZ BAGS Travel Laptop Backpack for Women & Men|Carry On Bag, College & School Students Bookbag With Raincover",₹999,4.2 out of 5 stars,120,https://www.amazon.in/SPENZ-BAGS-Backpack-Raincover-Baby-Pink/dp/B0C3RNFHHV
Wildcraft Work Packs'18 21 Ltrs Black Laptop Backpack (Streak Plus),"₹1,374",4.4 out of 5 stars,"1,976",https://www.amazon.in/Wildcraft-Packs18-Laptop-Backpack-Streak/dp/B07FC4D9B5
F Gear Colorado Grey Orange 39 Ltrs Laptop Backpack (3814),₹895,4.2 out of 5 stars,207,https://www.amazon.in/Gear-Colorado-Orange-Laptop-Backpack/dp/B097K6KD7W
Tommy Hilfiger Connor Laptop Backpack,"₹1,649",4.1 out of 5 stars,127,https://www.amazon.in/Hilfiger-Connor-Backpack-TH-CONNORLAP07/dp/B07N99SXB1
Dybbuk 25 Ltrs Laptop Backpack for Office & Travel Use for Men & Women | Water Resistance Bag | Fit Up to 15.6-inch Laptop,₹399,2.0 out of 5 stars,2,https://www.amazon.in/Dybbuk-Laptop-Backpack-Resistance-15-6-inch/dp/B0C5HLBY7D
Lunar's Bingo - 48 L Laptop Office/School/Travel/Business Backpack Water Resistant - Fits Up to 15.6 Inch Laptop Notebook with 1 Year Warranty,₹899,3.9 out of 5 stars,"9,890",https://www.amazon.in/Lunars-Bingo-Laptop-Resistant-48L/dp/B08YZ5XY31
"PAZZO Alto 40L Casual Backpack - 3 Compartment Travel Backpack, College|School Bag with 1 Year Warranty",₹849,4.0 out of 5 stars,"1,767",https://www.amazon.in/PAZZO-Alto-40L-Casual-Backpack/dp/B07VT3F795
NORTH ZONE Casual Waterproof Laptop Backpack/Office Bag/School Bag/College Bag/Business Bag/Travel Backpack (Dimensions:13x18 inches) (Compatible with 39.62cm(15.6inch laptop) 30 L (Blue & black),₹486,4.5 out of 5 stars,2,https://www.amazon.in/Waterproof-Backpack-College-Business-Dimensions/dp/B0BW95MXRJ
DZert Kids School Bag Soft Plush Backpacks Cartoon Boys Girls Baby (2-5 Years),₹249,3.8 out of 5 stars,"12,606",https://www.amazon.in/DZert-Fabric-Multicolour-Spiderman-Printed/dp/B07BNS3KNX
Half Moon 34 L Water Resistant 15.6 inch Laptop Bag/Backpack for Men Women Boys Girls/Office School College with Padded Laptop Compartment (Grey),₹699,3.9 out of 5 stars,"1,339",https://www.amazon.in/Half-Moon-Resistant-Backpack-Compartment/dp/B09GG53CSL
Martucci Jersey 45L Casual Waterproof Laptop Backpack/Office Bag/School Bag/College Bag/Business Bag/Unisex Travel Backpack,₹809,3.7 out of 5 stars,154,https://www.amazon.in/Martucci-Waterproof-Backpack-College-Business/dp/B0BRJRVH6D
"Amazon Basics Slope Basics Black Anti-theft 15.6 inches Laptop Bag, Office/College Backpack",₹869,4.5 out of 5 stars,212,https://www.amazon.in/Amazon-Basics-Anti-theft-College-Backpack/dp/B0C8NWKRRH
"MuscleBlaze Gym Duffle Bag for Women and Men, Sports Bag, Weekender Bag, Black, 30 L",₹449,5.0 out of 5 stars,4,https://www.amazon.in/MuscleBlaze-Duffle-Women-Sports-Weekender/dp/B0C8BBNB8B
HAMMONDS FLYCATCHER Laptop Bag for Men - Genuine Leather Messenger Shoulder Bag - Fits 14/15.6/16 Inch Laptops - Brown Office Bag - Multiple Pockets -Water Resistant -Executive Bag for Work and Travel,"₹5,255",4.4 out of 5 stars,571,https://www.amazon.in/Hammonds-Flycatcher-Leather-Messenger-LB190BRN/dp/B083M1QK32
Zipline Unisex Casual Polyester 36 L Blue Backpack School Bag Women Men Boys Girls College Bag,₹843,3.6 out of 5 stars,112,https://www.amazon.in/ZIPLINE-Polyester-Backpack-College-Outdoor/dp/B09XN3YD4Q
"Lenovo 15.6"" Professional Backpack, Made in India, Water-resistant,Uncompromised storage, Travel friendly:Fleece-lined PC compartment,Vented,Padded BackPanel & Adjustable shoulder straps,Luggage strap",₹700,4.2 out of 5 stars,902,https://www.amazon.in/Lenovo-Professional-Backpack-Water-resistant-Uncompromised/dp/B08R7S55H4
