product_name,price,rating,Number_of_Reviews,Product_url
Wildcraft 29.5 Ltrs Green Casual Backpack (11650-Green),"₹1,039",4.1 out of 5 stars,392,https://www.amazon.in/Wildcraft-Green-Casual-Backpack-11650-Green/dp/B079DV66TY
"GoTrippin Waist Bags for Men Women- Premium Stitching, Branded Zippers, Waterproof pocket, RFID safe- Large Fanny pack for Hiking Travel Camping Running Sports Outdoors, Money Belt with Adjustable Strap (Polyester,Black)",₹999,4.5 out of 5 stars,"2,149",https://www.amazon.in/GoTrippin-Camping-Outdoors-Polyester-Adjustable/dp/B088LHS5LP
"POLESTAR Noble 32 L Bag for College, School, Office, Casual Multipurpose Backpack with 15.6"" Laptop Compartment, Water Resistant, Unisex Design, Stylish & Durable, 1 Year Warranty",₹579,3.9 out of 5 stars,"17,691",https://www.amazon.in/POLESTAR-Casual-bagpack-School-Backpack/dp/B07PQQ8M7B
"Glowic Canvas Grocery, Travel, Beach | Shoulder Handbags Women, College Bags for Girls Stylish Trendy(WBAG-50)",₹489,3.5 out of 5 stars,244,https://www.amazon.in/Glowic-Grocery-Shoulder-Handbags-WBAG-50/dp/B09YRWZBW8
Amazon Basics 20 ltrs Casual/Travel/College Backpack for 15.6-inch Laptop | Water Resistant Fabric,₹399,4.2 out of 5 stars,644,https://www.amazon.in/Amazon-Basics-Casual-Backpack-15-6-inch/dp/B09W4WJ1CB
"FUR JADEN Travel Laptop Backpack, Business Backpacks with USB Charging Port, Water Resistant College School Computer Bag for Men & Women Fits Under 15.6 inch Laptop and Notebook","₹1,049",4.2 out of 5 stars,251,https://www.amazon.in/Backpack-Business-Backpacks-Charging-Resistant/dp/B094DGXXR5
COSMUS Vogue Casual Laptop Backpack with USB Charger Port 46cm 26 Litre Maroon College Bag,"₹1,409",4.2 out of 5 stars,"1,413",https://www.amazon.in/Cosmus-Casual-Backpack-Charger-College/dp/B09HX54TGF
"Aurion Vista Polyester Sports Gym Duffle Bag with Wet Pocket and Shoe Compartment - 1Pc (Blue, 24 Cms) | Lightweight Duffle Bags | Travel Duffel Backpack for Men and Women | Camping | Swimming | Yoga",₹349,4.0 out of 5 stars,"1,085",https://www.amazon.in/Shoulder-Lightweight-Duffle-Weekend-Blue-Orange/dp/B09139DYF1
"Half Moon 35L Water Resistant 15.6 inch Laptop Bag for Men/Backpack for Men, Black | Office Bag for Men/Office Bag for Women with Padded Laptop Compartment | Rain Cover & Reflective Strips",₹699,3.9 out of 5 stars,337,https://www.amazon.in/Half-Moon-Resistant-Laptop-Backpack/dp/B09842K4RQ
Aristrocrat Unisex Laptop Bag Grey One Size,₹799,4.3 out of 5 stars,29,https://www.amazon.in/Aristocrat-Zeal-Unisex-Grey-Laptop/dp/B0B5YHC1W5
satellite backpacks for men women backpack bags school bag boys under 35 ltr litres casual bagpack black,₹516,3.9 out of 5 stars,363,https://www.amazon.in/SATELLITE-Black-Casual-Backpack-Bagpack/dp/B083DZVFZM
ASIAN Sling Bag for Women - Handmade Bags for Females - Jute and Indian Fabric Slings - Side Bags for Mobile Phones and Wallets (Black),₹224,3.5 out of 5 stars,103,https://www.amazon.in/ASIAN-Sling-Bag-women-Handmade/dp/B09SXRZ7FW
RAPTORS 35L Water Resistant 15.6 inch Laptop Backpack bag for men and women Office/School/Travel/Business Padded with Laptop Compartment,₹719,5.0 out of 5 stars,5,https://www.amazon.in/RAPTORS-Resistant-Backpack-Business-Compartment/dp/B0C4Q4WN6V
POLICE Polyester 35 Ltr Laptop Big Low Spec Laptop Backpack - Black/Navy,"₹1,569",3.3 out of 5 stars,213,https://www.amazon.in/Police-Polyester-Laptop-Spec-Backpack/dp/B07ZB8NWTZ
K London Stylish Real Leather Black Waist Bag Elegant Style Travel Pouch Passport Holder with Adjustable Strap(246_Black),₹335,4.2 out of 5 stars,"2,372",https://www.amazon.in/London-Stylish-Passport-Adjustable-246_Black/dp/B07ZFT873B
"Skybags Unisex Polyester Solid Pattern Hustle Df 55 (Orange, Small)","₹1,590",4.3 out of 5 stars,314,https://www.amazon.in/SKYBAGS-Unisex-Luggage-Duffel-Bag-DFHUS55ONG/dp/B07F342RQD
Gear Eco4 18L Water Resistant School Bag//Backpack/College Bag for Men/Women - Navy Blue,₹494,4.0 out of 5 stars,"4,257",https://www.amazon.in/Gear-Green-Casual-Backpack-BKPECOBP40503/dp/B019HA8DQQ
"uppercase Medium 17 Ltrs Vegan Leather (upto 14 inch) Laptop Backpack 2300EBP1 3x more water resistant sustainable bags with rain proof zippers for Men, Women, Boys and Girls, 750 Days warranty","₹1,600",4.1 out of 5 stars,503,https://www.amazon.in/uppercase-Backpack-2300EBP1-repellent-sustainable/dp/B0B69M182Q
GOCART WITH G LOGO Laptop Backpack Casual Daypacks Briefcase Convertible Business Travel Rucksack with USB Charging Port Large College School Bookbag Computer Laptop Bag,"₹1,399",3.8 out of 5 stars,"1,452",https://www.amazon.in/GOCART-LOGO-Backpack-Briefcase-Convertible/dp/B0822H451W
AUXTER Premium Sports Gym Duflle Bag with Shoe Compartment for Men and Women,₹454,4.3 out of 5 stars,"1,280",https://www.amazon.in/Auxter-Premium-Sports-Compartment-Black-Green/dp/B08XWBDGMB
30 L Waterproof Laptop/College/School/Office Bag Backpack for Men Women Boys Girls with Rain Cover (Navy_Blue),₹489,4.6 out of 5 stars,6,https://www.amazon.in/Waterproof-Laptop-College-Backpack-Navy_Blue/dp/B0BW9GWPYH
"TRAVALATE Laptop Backpack with USB Charging Port for Travel, Office, Collage, Business Bag, Gift for Men and Women",₹798,3.7 out of 5 stars,54,https://www.amazon.in/TRAVALATE-Backpack-Charging-Collage-Business/dp/B0BLK8CF12
Wolpin Travel Bags for Luggage Spacious with Pockets Foldable Weekender Zipper Duffle Bag for Travel Stylish Handbag Conveniently Carry on Trolley Bag Waterproof (44 x 18 x 35 cm),₹389,4.2 out of 5 stars,29,https://www.amazon.in/Spacious-Foldable-Weekender-Conveniently-Waterproof/dp/B0BTTH69S9
Gear LOGI-Q 27L Water Resistant Laptop Bag/Backpack/Office Bag for Men/Women (Black-White),₹945,5.0 out of 5 stars,2,https://www.amazon.in/Gear-LOGI-Q-Resistant-Backpack-Black-White/dp/B0BTJ2VV17
American Tourister X-Bag Nylon 65 Cms Travel Duffle Bag (Black),"₹2,099",4.3 out of 5 stars,393,https://www.amazon.in/American-Tourister-40X-09-009/dp/B00FRCNTUO
AmazonBasics Nylon 43 Cms Travel Duffle Bag (Red),"₹1,727",4.3 out of 5 stars,"6,825",https://www.amazon.in/AmazonBasics-Ltrs-Large-Duffel-Bag/dp/B01GGNW5AM
Kuber Industries Faux Leather 20 Cms Duffle Bag(CTKTC34727_Grey),₹279,3.8 out of 5 stars,209,https://www.amazon.in/Kuber-Industries-Carrying-Multi-Purpose-CTKTC034727/dp/B083J6HVMB
Gear Workspace 18L Water Resistant Laptop Bag/Backpack/Office Bag for Men/Women-Black,₹907,4.2 out of 5 stars,336,https://www.amazon.in/Gear-Workspace-Briefcase-Black-Red-BKPWRPHYD0101/dp/B097KGL2M5
PUMA 0 Ltrs PUMA Black-Camo AOP School Backpack (7735101),"₹1,349",4.3 out of 5 stars,41,https://www.amazon.in/PUMA-Black-Camo-School-Backpack-7735101/dp/B07VN74LRB
