product_name,price,rating,Number_of_Reviews,Product_url
CAPRIFF 32 L Casual Waterproof Laptop Bag/Backpack for Men Boys & Girls For Office School College Teens & Students with Rain Cover With adjustable Strap With 2 Compartment,₹539,3.8 out of 5 stars,"3,100",https://www.amazon.in/Capriff-Liters-Collage-travell-Backpack/dp/B084T7X2HX
CAPRIFF 32 L Casual Waterproof Laptop Bag/Backpack for Men Boys & Girls For Office School College Teens & Students with Rain Cover With adjustable Strap With 2 Compartment,₹699,3.8 out of 5 stars,"3,100",https://www.amazon.in/Waterproof-Backpack-Students-adjustable-Compartment/dp/B09V5HRYR7
"URBAN TRIBE Havana Laptop Backpack for Men & Women | Laptop Bag 15.6 inch | Office Work/Casual/College Bag | Black, 27L",₹939,3.9 out of 5 stars,782,https://www.amazon.in/Urban-Tribe-Laptop-Backpack-Havana/dp/B01LXNNFDF
Wildcraft 35 Ltrs Casual Backpack (11619-Blue),"₹1,298",4.2 out of 5 stars,234,https://www.amazon.in/Wildcraft-Typo_Blu-Casual-Backpack-11619-Typo_Blu/dp/B079DDV3JD
"Meek HP Executive Essential Laptop Bag, 17.5Inch Padded Backpack Lightweight Bag - Grey Black",₹999.99,5.0 out of 5 stars,2,https://www.amazon.in/Meek-Executive-Essential-17-5Inch-Lightweight/dp/B0C7WKWTZJ
Impulse rucksack bags 60 litres travel bag for men tourist bag for travel backpack for hiking trekking Bag for men camping thames blue bag with 1 Year Warranty,₹999,4.0 out of 5 stars,339,https://www.amazon.in/Impulse-rucksack-60-backpack-trekking/dp/B09TDL9FJ8
NORTH ZONE Lightweight school bags Backpacks for Boys Girls Stylish men and women Casual Travel Laptop Bag College office,₹598,3.9 out of 5 stars,828,https://www.amazon.in/NORTH-ZONE-Lightweight-Backpacks-Stylish/dp/B0BL3S5NC1
Gear Classic 20L Faux Leather Water Resistant Anti Theft Laptop Bag/Backpack for Men/Women-Tan,₹979,4.4 out of 5 stars,"2,484",https://www.amazon.in/Classic-Leather-Laptop-Backpack-LBPCLSLTH1901/dp/B07G4CYC74
"COSMUS Madison waterproof Multipurpose Backpack With laptop compartment , 33L","₹1,375",4.2 out of 5 stars,"2,267",https://www.amazon.in/COSMUS-Multipurpose-Backpack-Bag-compartment/dp/B078JVT384
"DIVULGE Multi Utility Drawstring Bag (Black , 16 L)",₹155,4.0 out of 5 stars,"1,139",https://www.amazon.in/DIVULGE-Drawstring-Bag-Sports-Utility/dp/B07PXTDBH4
Red Lemon Swisslook Polyester Bange Series 45L 15.6-inch Laptop Bags Backpack for Men and Women Semi Waterproof USB with Anti Theft Pocket Travel Backpack,"₹2,839",4.3 out of 5 stars,"1,705",https://www.amazon.in/Swisslook-Polyester-15-6-inch-Backpack-Waterproof/dp/B07XYTZP4Z
Half Moon Aztec 37L School Bag Class 5-12 | College Bagpack for Men/College Back pack for Women | 15.6 inch Laptop Bag for Men/Backpack for Men | Spacious & Multiple Pockets,₹599,3.7 out of 5 stars,148,https://www.amazon.in/Half-Moon-Backpack-Spacious-Multiple/dp/B0C6N3MYL2
Trajectory 15.6 Inch Vegan Leather Messenger Laptop bag for men in Office for all laptop like Apple MacBook with 2 Years Warranty and Spacious Multiple Compartment with Expandable Bottom Used as Shoulder and Handbag for Men,"₹1,399",4.1 out of 5 stars,474,https://www.amazon.in/Trajectory-Elegant-15-6-Laptop-Office/dp/B09RK6NCGC
"Sfane Polyester 9.05 Black Men & Women Trendy Black Sports Duffle Gym Bag, Shoulder Bag",₹359,4.2 out of 5 stars,"1,231",https://www.amazon.in/Sfane-Women-Trendy-Black-Duffel/dp/B07GCR84D9
Asus BP1504 39.62 cm (15.6-inch) Laptop Backpack (Dark Grey),₹819,4.2 out of 5 stars,"1,692",https://www.amazon.in/Asus-BP1504-15-6-inch-Laptop-Backpack/dp/B0895ZZHKK
Dell Laptop bag,"₹2,499",4.2 out of 5 stars,181,https://www.amazon.in/Yours-Choice-Briefcase-Messenger-Detachable/dp/B0B6PF1L69
"POLESTAR Ranker 15.6 inch 32 LTR Casual Laptop Backpack/Office Bag/School Bag/College Bag/Business Bag/Unisex Backpack, Water Resistant and Light Weight, 1 year Warranty",₹669,4.1 out of 5 stars,"7,565",https://www.amazon.in/POLESTAR-Ranker-Casual-Bagpack-Backpack/dp/B08421BRQ2
"Veneer Medium 20 L Laptop Backpack Men Womens Girls Fashion PU Leather Mini Casual Backpack Bags for School, College, Tuition, Office Bag",₹998,4.2 out of 5 stars,928,https://www.amazon.in/Veneer-Backpack-Fashion-Leather-College/dp/B09BMG8R6Y
Half Moon Valex Unisex School Bag/Laptop Backpack/College Bagpack/Office Back Packed | Laptop Bag for Men & Women | School Bags for Boys & Girls with Small Pockets & Laptop Compartment,₹649,3.7 out of 5 stars,60,https://www.amazon.in/Half-Moon-Laptop-Bag-Compartment/dp/B0C1NZLF67
"uppercase Apex Professional Laptop Backpack (15.6 Inch) 3x more water resistant sustainable bags with rain proof zippers for Men, Women, Boys and Girls, 750 Days warranty","₹1,800",4.3 out of 5 stars,66,https://www.amazon.in/uppercase-Professional-Backpack-resistant-sustainable/dp/B0BWNBQXDZ
Half Moon Aztec 37L School Bag Class 5-12 | College Bagpack for Men/College Back pack for Women | 15.6 inch Laptop Bag for Men/Backpack for Men | Spacious & Multiple Pockets,₹649,3.7 out of 5 stars,148,https://www.amazon.in/Half-Moon-Backpack-Spacious-Multiple/dp/B0C23Z9W18
Half Moon Strike 35L Unisex Spacious School/Laptop/College/Office Travel Backpack Bag for Men Women Boys & Girls with 15.6 inch Padded Laptop Compartment & Multiple Pockets,₹699,3.5 out of 5 stars,18,https://www.amazon.in/Half-Moon-Spacious-Backpack-Compartment/dp/B0C23BYDML
ADISA 32L Large Laptop Backpack Office Bag College Travel Back Pack with rain Cover (Green),₹646,3.8 out of 5 stars,261,https://www.amazon.in/ADISA-Laptop-Backpack-Office-College/dp/B0BPVCBFM7
"HARISSONS Bags Vervo 15.6-inch Laptop/Travel/Casual Backpack for Men and Women with Rain Cover (Black, 40 Ltrs) | Quick Access Zippered Pocket, Detailed Organizers & a Detachable Key Chain Holder","₹2,960",4.3 out of 5 stars,"1,999",https://www.amazon.in/Harissons-Vervo-Laptop-Backpack-Built/dp/B07M5P5LW3
"MosQuick® Clear large Drawstring Bags Clear Plastic Travel Bags, Travel Garments Organizing Storage Plastic Bags ,Shoe bags , Stationery Bag,multipurpose bag - Translucent",₹310,4.0 out of 5 stars,69,https://www.amazon.in/MosQuick%C2%AE-Drawstring-Organizing-Stationery-multipurpose/dp/B09SB42QFQ
Martucci Large 35 L Backpack Spacy Unisex/College/School/Travel Backpack with Rain Cover and Reflective Strip,₹746,4.0 out of 5 stars,"1,217",https://www.amazon.in/Martucci-Laptop-Backpack-College-Reflective/dp/B0B7DT6HY3
"EUME Virgo 3 Compartment Office and College Bags, Polyester Casual Daypacks, Laptop Backpacks","₹1,199",4.2 out of 5 stars,297,https://www.amazon.in/EUME-Virgo-29Ltr-Laptop-Backpack/dp/B08R563J3T
Skybags 22 ltrs (16 Cms) backpack(BPFLE22EBTH_Blith),₹904,4.1 out of 5 stars,33,https://www.amazon.in/Skybags-Unisex-Blith-Jacquard-Backpacks/dp/B0B21Z3DBD
18 L Multicolour Printed Drawstring Polyester Multi Utility Bag for Sports/Gym/Yoga/College/Casual Backpack – Light Weight/Washable,₹199,4.4 out of 5 stars,6,https://www.amazon.in/Multicolour-Printed-Drawstring-Polyester-Backpack/dp/B09ZL3SCTQ
Aristocrat Unisex Black Oxford Fabric 28.82L Laptop Bags,₹760,3.5 out of 5 stars,62,https://www.amazon.in/Aristocrat-Unisex-Oxford-Fabric-28-82L/dp/B09ZV86P4S
Gear Parker 23L Water Resistant Anti Theft Laptop Bag/Backpack for Men/Women - Black,₹644,4.3 out of 5 stars,424,https://www.amazon.in/Gear-Executive-Anti-Theft-Backpack-BKPPKREXE0101/dp/B097KCMQKG
Nivia Pulse Junior Bag (Orange),₹219,3.7 out of 5 stars,223,https://www.amazon.in/Nivia-5227-Junior-Others-Orange/dp/B08D7QKCX5
House of Quirk Baby Diaper Bag Maternity Backpack (Blue Elephant Printed),"₹1,399",4.3 out of 5 stars,"3,906",https://www.amazon.in/House-Quirk-Maternity-Backpack-Elephant/dp/B07QV7SH4S
"MOKOBARA The Work Backpack - II Black Nylon Water Resistant (16"") Laptop | Work | Travel Bag for Men and Women","₹8,999",4.0 out of 5 stars,1,https://www.amazon.in/MOKOBARA-Work-Backpack-Resistant-Reflection/dp/B0C9J8JJ6C
LOOKMUSTER Casual Waterproof Laptop Backpack/Office Bag/School Bag/College Bag/Business Bag/Travel Backpack…,₹499,3.8 out of 5 stars,35,https://www.amazon.in/LOOKMUSTER-Waterproof-Backpack-College-Business/dp/B0BS6YGKMC
F Gear Enzo Sports Waist Bag (Enzo Spruce Yellow),₹265,4.2 out of 5 stars,201,https://www.amazon.in/F-Gear-Enzo-Waist-Bag-Enzo-Spruce-Yellow/dp/B08QM71P12
NIVIA Beast Gym Bag-4 Polyester/Unisex Gym Bags/Shoulder Bag for Men & Women with Separate Shoes Compartment/Carry Gym Accessories/Fitness Bag/Sports & Travel Bag/Sports Kit (Navy Blue),₹523,3.9 out of 5 stars,110,https://www.amazon.in/Nivia-5183NB-Gym-Navy-Blue/dp/B07NJGW3WX
"Tabelito® DELTA Casual Waterproof Laptop Backpack/Office Bag/School Bag/College Bag/Business Bag/Unisex Travel Backpack (Compatible with 15.6 inch Laptop) 30 L, (6 Month Warranty)",₹599,4.6 out of 5 stars,190,https://www.amazon.in/Tabelito%C2%AE-Delta-Waterproof-Backpack-Compatible/dp/B0BLK1Z7DQ
"Chic Buddy Waterproof Wet Bag, Washable, Reusable for Travel, Beach, Pool, Stroller, Diapers, Dirty Gym Clothes, Wet Swimsuits, Toiletries",₹299,4.4 out of 5 stars,380,https://www.amazon.in/Chic-Buddy-Waterproof-Swimsuits-Toiletries/dp/B09KSBHC18
"uppercase SealPro Professional Laptop Backpack (15.6 Inch) 3x more water resistant sustainable bags with rain proof zippers & Anti-theft for Men, Women, Boys and Girls, 750 Days warranty","₹1,900",4.6 out of 5 stars,68,https://www.amazon.in/uppercase-Professional-resistant-sustainable-Anti-theft/dp/B0BR1C59R8
"Puma Laptop Backpack (7548709, Limoges, 22 Ltrs)",₹999,4.3 out of 5 stars,788,https://www.amazon.in/PUMA-Limoges-Laptop-Backpack-7548709/dp/B07D5QZ76G
DZert Clasy Laptop Bag College Bag for Boys Girls 21 L Blue White,₹339,3.8 out of 5 stars,"2,495",https://www.amazon.in/DZert-School-Polyester-Backpack-White/dp/B07GXYHFCY
"Red Lemon Swiss Cut Design 15.6 Inch Smart Laptop Backpack Bag With USB Charging Port, Anti Theft Pocket and Accessories Organiser for Men Women Boys Girls","₹1,799",4.4 out of 5 stars,"1,053",https://www.amazon.in/Red-Lemon-Capacity-Backpack-Multifunctional/dp/B09RK4BRPM
"Genie Fringe Laptop Backpack for Women, 3 compartments, Stylish and Trendy College Bags for Girls, Water Resistant and Lightweight Bags for Office and Travelling Purpose. 36 litres","₹1,299",5.0 out of 5 stars,7,https://www.amazon.in/Genie-compartments-Resistant-Lightweight-Travelling/dp/B097JJ64SH
Half Moon 30L Waterproof 15.6 inch Laptop Office School College Bag Backpack for Men Women Boys & Girls,₹589,3.7 out of 5 stars,376,https://www.amazon.in/Half-Moon-Waterproof-Laptop-Backpack/dp/B09QM9N1B3
AUXTER Faux Leather 23 Cms Duffle Bag(AUX_GB_LE_Black -SE__0521_Black),₹429,4.3 out of 5 stars,"9,246",https://www.amazon.in/AUXTER-BLACKY-Duffel-Emboss-Black/dp/B07F2H25NP
"Fast Travel 45 Ltrs, 46 cms School Bag Class 5-12 Large 4 partition Laptop Collage Office Travel Backpack Unisex",₹692,4.1 out of 5 stars,945,https://www.amazon.in/Fast-Travel-partition-Collage-Backpack/dp/B09VCQWRC4
"Chic Buddy Waterproof Wet Bag, Washable, Reusable for Travel, Beach, Pool, Stroller, Diapers, Dirty Gym Clothes, Wet Swimsuits, Toiletries",₹299,4.4 out of 5 stars,380,https://www.amazon.in/Chic-Buddy-Waterproof-Swimsuits-Toiletries/dp/B0B25B5PB6
Wooum Sling Cross Body Bag/One Side Bag/Shoulder Bag/Office Business Messenger Bag/Money Bag for Men and Women - Water Resisitance,₹328,4.0 out of 5 stars,708,https://www.amazon.in/Wooum-Resisitance-Shoulder-Business-Messenger/dp/B0993Q72WD
Lavie Sport Chairman Backpack with Laptop Sleeve | Premium Leatherette Business Backpack for Men & Women | Durable Office Bag for Notebook/MacBook,₹849,4.0 out of 5 stars,"1,246",https://www.amazon.in/Lavie-Sport-Chairman-Compatible-compartments/dp/B09YCSCRBW
Pramadda Pure Luxury Milan Casual Vegan Leather 15.6 inch Laptop Backpack for Men and Women | Stylish School College Office Travel Bagpacks | Trendy Office Laptop Bag For Men. (Classic Black),"₹1,200",4.9 out of 5 stars,11,https://www.amazon.in/Pramadda-Pure-Luxury-Backpack-Bagpacks/dp/B0C6NNPZTC
"Arctic Hunter Mens Sling Bag,Mens Shoulder Bag,Crossbody Bag for Men,Chest Bag,Daypack,Shockproof Compartment for iPad,Suitable for College,Outdoor Travels and Business Daily Use For Men, Black","₹1,399",4.4 out of 5 stars,513,https://www.amazon.in/Shoulder-Crossbody-Shockproof-Compartment-k00063-Black/dp/B09HV9QYFB
Skybags Unisex Gucci Fabric Backpacks,₹584,4.2 out of 5 stars,268,https://www.amazon.in/Skybags-Unisex-Yellow-Fabric-Backpacks/dp/B0B21XM4KX
PUMA 26 Ltrs Puma Black Laptop Backpack,"₹1,239",3.8 out of 5 stars,89,https://www.amazon.in/Puma-Black-Laptop-Backpack-7573301/dp/B07JHJCZSM
ADISA SL5038 women girls sling bag,₹564,4.1 out of 5 stars,"1,191",https://www.amazon.in/ADISA-SL5038-women-girls-sling/dp/B08Q4FHQLN
Lavie Sport Polar X Cabin Size 63 cms Wheel Duffel Bag for Travel | Travel Bag with Trolley,"₹1,399",4.0 out of 5 stars,812,https://www.amazon.in/Lavie-Sport-Polyester-Travel-BDFW223019M4/dp/B07VJSDYJY
Arctic Hunter Backpack for Men Premium Business Backpack Office Travel Laptop Bag with 15.6 Inch Laptop Pocket Water/Scratch-resistant Multiple Pocket Comfortable and Padded Backpack for Men,"₹5,999",4.4 out of 5 stars,150,https://www.amazon.in/Backpack-Business-Scratch-resistant-Multiple-Comfortable/dp/B0B6FNPN76
"Casual Waterproof Laptop Bag/Backpack for Men Women Boys Girls/Office School College Teens & Students with Free Rain Cover (18 Inch, 34litr) (Black)",₹355,3.0 out of 5 stars,1,https://www.amazon.in/Szeentp-Waterproof-Backpack-College-Students/dp/B08XWBCVZT
JAVILANT 35L Waterproof Rain & Dust Cover for Backpack with Pouch | Rain Cover for Laptop/School/College & Office Bag Black Color with Orange Print,₹219,5.0 out of 5 stars,1,https://www.amazon.in/JAVILANT-Waterproof-Backpack-Laptop-College/dp/B0C9J7CV3P
Lunar's Heritage 37L Casual Water Resistant 3 Compartment Travel Bagpack/College Backpack/School Bag (Black),₹799,4.0 out of 5 stars,874,https://www.amazon.in/Lunars-Heritage-Casual-Bagpack-College/dp/B08CBJDBH4
"Tabelito® NEXA 3O L Water Resistant Laptop/College/Office/School/Travel/Business Bag, Unisex Backpack for Men Women Fits Up to 15.6 Inch Laptop Notebook. (GREY)",₹399,4.3 out of 5 stars,75,https://www.amazon.in/Tabelito-NEXA-Backpack-Business-Compartment/dp/B0C2D4T9R5
ADISA 15.6 inch Laptop Backpack Office Bag College Travel Back Pack 32 Ltrs (z-Black),₹549,3.9 out of 5 stars,"1,015",https://www.amazon.in/ADISA-Laptop-Backpack-College-z-Black/dp/B09TPY1G1W
Gear Polyester 23 Cms Travel Bag(DUFCRSTNG4314_Khaki),₹489,4.1 out of 5 stars,531,https://www.amazon.in/Gear-Training-Travel-Duffel-DUFCRSTNG4314/dp/B098FG3GVX
Wildcraft 44 cms Polyester Black Laptop Bag (8903338054290),"₹1,448",4.3 out of 5 stars,672,https://www.amazon.in/Wildcraft-Polyester-Black-Laptop-8903338054290/dp/B012D4QKHW
"HAMMONDS FLYCATCHER Genuine Leather Laptop Bag for Men - Office Bag, Brown Color - Fits Up to 14/15.6/16 Inch Laptop/MacBook - Laptop Messenger Bags/Leather Bag for Men with Adjustable Shoulder Strap","₹2,623",4.3 out of 5 stars,"4,904",https://www.amazon.in/HAMMONDS-FLYCATCHER-Genuine-Shoulder-Messenger/dp/B07P2TQH78
"F Gear Blow Laptop Backpack With Rain Cover 32 Liters (Black,Grey) Sch Bag","₹1,099",4.3 out of 5 stars,"1,287",https://www.amazon.in/F-Gear-Blow-Laptop-Backpack/dp/B078J63VRY
ZOUK Black Floral Printed Handmade Vegan Leather Women's Office Bag for 15.6 inch Laptop with double handles - FloMotif,"₹1,689",4.3 out of 5 stars,955,https://www.amazon.in/FloMotif-Business-Shoulder-material-resistant/dp/B07NHYLTY7
18 L Attractive long lasting Printed Drawstring Polyester Multi Utility Bag for Sports/Gym/College/Yoga/Casual Backpack – Light Weight (Washable/Durability),₹199,4.0 out of 5 stars,11,https://www.amazon.in/Attractive-lasting-Drawstring-Polyester-Backpack/dp/B0B4G9XT67
"AirCase Laptop Bag Backpack Case Pouch for Laptop Backpack for Men & Women,Premium Vegan Leather",₹929,4.0 out of 5 stars,"1,077",https://www.amazon.in/AirCase-C34-Laptop-Backpack-Women/dp/B07QL8633G
NORTH ZONE Lightweight school bags Backpacks for Boys Girls Stylish men and women Casual Travel Laptop Bag College office,₹551,3.9 out of 5 stars,828,https://www.amazon.in/NORTH-ZONE-Lightweight-Backpacks-Stylish/dp/B0BL3SDSGZ
OMRON BAGS Large 40 L Laptop Backpack For Men and Women,₹725,5.0 out of 5 stars,3,https://www.amazon.in/OMRON-BAGS-Backpack-Black-New/dp/B0BLJZGTMZ
Gear Solid 22 Cms Cosmetic Pouch (Black),₹439,4.5 out of 5 stars,"4,255",https://www.amazon.in/GEAR-Black-Toiletry-Bag-ACCTLTPCH0112/dp/B019HA8JJW
TUFFGEAR Polyester Gym Bag Workout 23 Litre Gym Duffle Bag Yellow,₹563,4.1 out of 5 stars,999,https://www.amazon.in/TUFFGEAR-Workout-Litre-Duffle-Yellow/dp/B08R7HYFM1
"HYDER 35L Latest And Trendy Stylish Waterproof College/Casual/School Bag/Backpack For Kids, Boys, Girls, Men And Women | Best Bags For Everyday Use",₹735,4.2 out of 5 stars,130,https://www.amazon.in/HYDER-Gamepad-Waterproof-Backpack-Everyday/dp/B0BR3KK8TR
30 L Waterproof Laptop/College/School/Office Bag Backpack for Men Women Boys Girls with Rain Cover (Navy_Blue),₹486,4.6 out of 5 stars,6,https://www.amazon.in/Waterproof-Laptop-College-Backpack-Navy_Blue/dp/B0BW9BTJCZ
LuvLap Lily Travel Multifunctional Waterproof Diaper Bag-Backpack Cum Tote Bag (Black),"₹1,149",4.4 out of 5 stars,935,https://www.amazon.in/LuvLap-Travel-Multifunctional-Waterproof-Bag-Backpack/dp/B07W6Z8XKB
"Storite Small Size Army Print Padded Nylon Cross Body Sling bag Office Travel One Side Bag for Men Women (25x19x7cm, GreenGrey)",₹395,4.1 out of 5 stars,478,https://www.amazon.in/Storite-Army-Print-Sling-GreenGrey/dp/B09KNMWWPH
Impulse Impbee 45L Laptop Backpack/Office Bag/School Bag/College Bag/Business Bag/Travel Backpack Water Resistant Fits Up to 16 Inch Laptop with Rain Cover & 1 Year Warranty,₹881,4.0 out of 5 stars,6,https://www.amazon.in/Impulse-Impbee-Backpack-Business-Resistant/dp/B0C1CSS81H
"Bennett Casual Laptop Bag school bags for boys girls 15.6-inch, 25 LTR Office & College bags for mens Water Repellent Backpack for Men & Women (Black)",₹512,3.9 out of 5 stars,326,https://www.amazon.in/Bennett-15-6-inch-College-Repellent-Backpack/dp/B09WZHX3B1
Safari Seek 45 Ltrs Overnighter Expandable Travel Laptop Backpack,"₹2,499",4.5 out of 5 stars,"7,239",https://www.amazon.in/Safari-45L-21-OB-BLK/dp/B07BZ5VC4H
"FUR JADEN Anti Theft Number Lock Backpack Bag with 15.6 Inch Laptop Compartment, USB Charging Port & Organizer Pocket for Men Women Boys Girls",₹670,4.0 out of 5 stars,"4,901",https://www.amazon.in/Number-Backpack-Compartment-Charging-Organizer/dp/B09VTC876Z
Murano Louis 10ltr Casual daybackpack/Office & Travel Bag/School Bag/College Bag/Men/Women/Girl/Boy (Orange),₹176,3.1 out of 5 stars,36,https://www.amazon.in/Murano-Casual-daybackpack-Office-College/dp/B0BX9FLPNX
DZert Clasy Laptop Bag College Bag for Boys Girls 21 L Red Black,₹339,3.8 out of 5 stars,"2,495",https://www.amazon.in/DZert-Polyester-Black-White-Backpack/dp/B07GXX2BP3
ADISA Large Laptop Backpack Office Bag College Travel Back Pack with USB (Black),₹599,3.8 out of 5 stars,80,https://www.amazon.in/ADISA-Laptop-Backpack-Office-College/dp/B0BXQZ6Q85
MI Business Casual 21L Water Resistant Laptop Backpack,₹949,4.4 out of 5 stars,"4,513",https://www.amazon.in/Mi-Business-Casual-Resistant-Backpack/dp/B07YY6PTMN
Lavie Women's Ushawu Satchel Bag | Ladies Purse Handbag,"₹1,249",4.1 out of 5 stars,"6,814",https://www.amazon.in/Lavie-Womens-Ushawu-Satchel-Handbag/dp/B0B3J9J9CK
Gear ECO1 24L Water Resistant Laptop Bag/Backpack/Office Bag for Men/Women- Grey-Black-Yellow,₹845,4.2 out of 5 stars,"1,464",https://www.amazon.in/Gear-Polyester-Laptop-Backpack-LBPECONO10412/dp/B012NW0J30
Skybags Kick Unisex Adjustable Strap Polyester Laptop Backpack,"₹1,576",4.0 out of 5 stars,53,https://www.amazon.in/Skybags-Unisex-Adjustable-Polyester-Backpack/dp/B0BJ763F7Y
Gear polyester 44 cms Duffle Bag(DUFPRO2000106_Black),₹431,4.3 out of 5 stars,834,https://www.amazon.in/Gear-ltr-Black-Orange-DUFPRO2000106/dp/B00Z93WSVW
Half Moon 35 L Casual Waterproof Laptop Bag/Backpack for Men Women Boys Girls/Office School College Teens & Students with Rain Cover (18 Inch) (Sky Blue),₹699,3.6 out of 5 stars,87,https://www.amazon.in/Half-Moon-Waterproof-Backpack-Students/dp/B0BR149RMT
Shopiable Store Folding Storage Luggage Bag Travelling Shoulder Hand Bags Lightweight Waterproof Duffle Bag for Women (Pink),₹379,4.1 out of 5 stars,14,https://www.amazon.in/Shopiable-Store-Travelling-Lightweight-Waterproof/dp/B0B5VMZVXZ
Skybags Unisex Grey Jacqard 34L Laptop Bags,"₹1,279",4.0 out of 5 stars,63,https://www.amazon.in/Skybags-Unisex-Grey-Jacqard-Laptop/dp/B09ZV9SLBJ
"Mi Step Out 12 L Mini Backpack (Small Size, Sky Blue, Water Repellant)",₹309,4.1 out of 5 stars,"9,457",https://www.amazon.in/Step-Backpack-Small-Water-Repellant/dp/B088X9M73T
Wildcraft Turnaround Polyester 35 Ltrs Blue Laptop Bag (8903338054702),"₹1,840",4.3 out of 5 stars,"1,204",https://www.amazon.in/Wildcraft-Turnaround-Polyester-Laptop-8903338054702/dp/B012D51GXO
Fast Travel School Bag Class 5-7 Large 3 partition 35 L Laptop Collage Office Travel Backpack Unisex (Red White),₹549,4.1 out of 5 stars,"1,109",https://www.amazon.in/Fast-Travel-partition-Collage-Backpack/dp/B09XLKF4W4
Lenovo Everyday Laptop Backpack B515 15.6-inch Water Repellent Black,"₹1,499",4.1 out of 5 stars,"3,709",https://www.amazon.in/Lenovo-Laptop-Everyday-Backpack-Black/dp/B07GM5NR14
COSMUS Darwin Navy Blue Laptop Backpack for (15.6 inch),"₹1,333",4.3 out of 5 stars,"10,026",https://www.amazon.in/COSMUS-Polyester-Navy-Laptop-Backpack/dp/B01FVQLLU0
F Gear Tycoon 27 Liters Laptop Backpack Sch Bag(Black),"₹1,149",4.4 out of 5 stars,251,https://www.amazon.in/F-Gear-Tycoon-Laptop-Backpack/dp/B071XJ6XV5
Arctic Hunter Laptop Bag Expandable Backpack for 16 inch Lapotp 40L Travel Backpack Water-resistant Business School Backpack with USB Port for Men and Women,"₹3,699",4.4 out of 5 stars,105,https://www.amazon.in/Expandable-Backpack-Water-resistant-Business-Charging/dp/B0B6FNB898
high power Lightweight school bags Backpacks for Boys Girls Stylish men and women Casual Travel Laptop Bag College office (Black) 30 LTR,₹625,5.0 out of 5 stars,1,https://www.amazon.in/high-power-Lightweight-Backpacks-Stylish/dp/B0BKL76TV3
American Tourister Ohio Polyester 65 Cms Wheel Travel Duffle Bag (Blue),"₹1,999",4.2 out of 5 stars,"1,269",https://www.amazon.in/American-Tourister-FJ9-01-002/dp/B07N19CXKM
ADISA 32L Large Laptop Backpack Office Bag College Travel Back Pack with rain Cover (Navy),₹699,3.8 out of 5 stars,43,https://www.amazon.in/ADISA-Laptop-Backpack-Office-College/dp/B0BVRJYD9Q
"SACCI MUCCI Women's Rainbow Sling Bag, Handmade Bags for Females - 100% Vegan Leather and Coated Duck canvas Fabric, Lightweight and Durable",₹499,4.2 out of 5 stars,898,https://www.amazon.in/SACCI-MUCCI-Allamanda-Lightweight-SM1-10_magnolia/dp/B09TDNZ88Z
"Bennett Casual Laptop Bag School Bags for Boys Girls 15.6-inch, 25 LTR Office & College bags for Mens Water Repellent Backpack for Men & Women (GREY)",₹512,3.9 out of 5 stars,170,https://www.amazon.in/Bennett-15-6-inch-College-Repellent-Backpack/dp/B09WZKHSDR
Lavie Women's Betula Tote Bag | Ladies Purse Handbag,₹999,4.0 out of 5 stars,"20,233",https://www.amazon.in/Lavie-Betula-Womens-Tote-Mint/dp/B08J8M2B42
ROZEN Stylish roz401-Sky Blue Laptop Backpack for School Collage Office Travelling Waterproof School Bag (Sky Blue 40 LTR),₹588,4.0 out of 5 stars,48,https://www.amazon.in/Rozen-Polyester-Waterproof-Backpack-Travelling/dp/B07R1S92QS
ADISA Women's Girls Party Sling Bag Crossbody,₹378,4.0 out of 5 stars,569,https://www.amazon.in/ADISA-Womens-Girls-Party-Crossbody/dp/B0B2WBJ2H8
"uppercase Laptop Backpack Printed Compact 3x more water repellent sustainable bags with rain proof zippers for Men, Women, Boys & Girls, 750 Days warranty (Blue)","₹1,350",4.1 out of 5 stars,100,https://www.amazon.in/uppercase-Backpack-1800EBP2-resistant-sustainable/dp/B0BQYJ8WP5
Gear Classic 20L Faux Leather Water Resistant Anti Theft Laptop Bag/Backpack for Men/Women-Black,₹979,4.4 out of 5 stars,"2,707",https://www.amazon.in/Gear-Classic-Leather-Backpack-LBPCLSLTH0101/dp/B07G4D13LB
"POLESTAR Leader 34 L Bag for College, School, Office, Casual Multipurpose Backpack with 15.6"" Laptop Compartment, Water Resistant, Unisex Design, Stylish & Durable, 1 Year Warranty",₹599,4.1 out of 5 stars,"3,511",https://www.amazon.in/POLESTAR-backpack-Backpack-College-Students/dp/B08X2KRL8B
American Tourister SPIN LAPTOP BACKPACK 28L POLYESTER BLACK,₹899,3.4 out of 5 stars,29,https://www.amazon.in/American-Tourister-LAPTOP-BACKPACK-POLYESTER/dp/B0BLCXMTZ7
Aristocrat Unisex Black Premium Polyester Fabric 28L Backpacks,"₹1,322",4.3 out of 5 stars,102,https://www.amazon.in/Aristocrat-Unisex-Premium-Polyester-Backpacks/dp/B09ZV6SBFS
F Gear Burner P8 19 Ltrs White Casual Laptop Backpack,₹661.75,4.3 out of 5 stars,"3,993",https://www.amazon.in/F-Gear-Burner-Casual-Laptop-Backpack/dp/B016115VXW
"Red Lemon Titan Ultrafit Plus Bange Series 15.6-inch Laptop Bags Backpacks for Men and Women55L Outdoor and Camping 3in1 Office Bags,Travelling,Backpack","₹3,799",4.4 out of 5 stars,462,https://www.amazon.in/Ultrafit-15-6-inch-Backpacks-Travelling-Backpack-Black/dp/B082Y7TZ8Z
"AmazonBasics Laptop Backpack - 24L, Water Repellent and Wear Resistant, Dark Grey",₹799,4.2 out of 5 stars,644,https://www.amazon.in/Amazon-Basics-Laptop-Backpack-Repellent/dp/B09W49FSX1
FUR JADEN 15.6 Anti Theft Laptop Backpack with USB Charging Port Unisex Bag for College Office Suitable for Men Women,₹749,4.0 out of 5 stars,"6,150",https://www.amazon.in/FUR-JADEN-Waterproof-Charging-BM25_Grey/dp/B07FM9BSKW
Kuber Industries Rexine Jumbo Attachi Travel Blanket Cover|Travel Duffle|Storage Carrying Bag|Travel Multi-Purpose Bag|Size 58 x 48 x 34 CM (Grey) CTKTC034726,₹396,3.7 out of 5 stars,918,https://www.amazon.in/Kuber-Industries-Carrying-Multi-Purpose-CTKTC034726/dp/B083J6774T
